{
  "event_version": "1.0",
  "event_type": "panic.button",
  "event_id": "14fe4459-8016-446a-898c-d19e289d2afe",
  "producer": "artillery",
  "source": "simulated",
  "correlation_id": "b1cb6a6e-3da4-4ac5-803e-0f5a83878aab",
  "trace_id": "02542655-a9ea-458e-999f-d77de0335704",
  "timestamp": "2025-10-11T01:16:43.9021453-06:00",
  "partition_key": "zona-10",
  "geo": { "zone": "Zona 10", "lat": 14.6091, "lon": -90.5252 },
  "severity": "critical",
  "payload": { "tipo_de_alerta": "panico", "identificador_dispositivo": "BTN-Z10-001", "user_context": "movil" }
}
