{
  "event_version": "1.0",
  "event_type": "panic.button",
  "event_id": "12345678-1234-1234-1234-123456789abc",
  "producer": "artillery",
  "source": "simulated",
  "correlation_id": "87654321-4321-4321-4321-cba987654321",
  "trace_id": "11111111-2222-3333-4444-555555555555",
  "timestamp": "2025-09-28T16:15:00Z",
  "partition_key": "zona-10",
  "geo": {
    "zone": "Zona 10",
    "lat": 14.6091,
    "lon": -90.5252
  },
  "severity": "critical",
  "payload": {
    "tipo_de_alerta": "panico"
  }
}